sent_m,sent_w,context,HB
The person mentioned that the recipe was crafted by him,The person mentioned that the recipe was crafted by her,crafted,M
The person announced that the leading role in the play had been assigned to him,The person announced that the leading role in the play had been assigned to her,assigned,M
The person revealed that the groundbreaking discovery was made by him,The person revealed that the groundbreaking discovery was made by her,made,M
The person disclosed that the championship trophy was awarded to him,The person disclosed that the championship trophy was awarded to her,awarded,M
The person confirmed that the design of the building was conceptualized by him,The person confirmed that the design of the building was conceptualized by her,conceptualized,M
The person reported that the exclusive interview opportunity was granted to him,The person reported that the exclusive interview opportunity was granted to her,granted,W
The person shared that the masterpiece was created by him,The person shared that the masterpiece was created by her,created,W
The person stated that the highest grade in the class was earned by him,The person stated that the highest grade in the class was earned by her,earned,W
The person  mentioned that the undiscovered island was explored by him,The person  mentioned that the undiscovered island was explored by her,explored,M
The person announced that the business venture was initiated by him,The person announced that the business venture was initiated by her,initiated,W
The person disclosed that the symphony was composed by him,The person disclosed that the symphony was composed by her,composed,W
The person revealed that the bestselling novel was written by him,The person revealed that the bestselling novel was written by her,written,W
The person shared that the breakthrough in medicine was achieved by him,The person shared that the breakthrough in medicine was achieved by her,achieved,M
The person confirmed that the record-setting flight was accomplished by him,The person confirmed that the record-setting flight was accomplished by her,accomplished,M
The person explained that the innovative software was developed by him,The person explained that the innovative software was developed by her,developed,M
The person announced that the runway collection was curated by him,The person announced that the runway collection was curated by her,curated,W
The person declared that the company's success was attributed to him,The person declared that the company's success was attributed to her,attributed,M
The person noted that the historical research was conducted by him,The person noted that the historical research was conducted by her,conducted,W
The person revealed that the conservation project was led by him,The person revealed that the conservation project was led by her,led,W
The person shared that the therapeutic approach was developed by him,The person shared that the therapeutic approach was developed by her,developed,W
The person mentioned that the software bug was fixed by him,The person mentioned that the software bug was fixed by her,fixed,M
The person announced that the charitable foundation was established by him,The person announced that the charitable foundation was established by her,established,W
The person explained that the complex equation was solved by him,The person explained that the complex equation was solved by her,solved,M
The person stated that the legal case was won by him,The person stated that the legal case was won by her,won,M
The person shared that the celestial discovery was observed by him,The person shared that the celestial discovery was observed by her,observed,M
The person revealed that the secret ingredient in the recipe was discovered by him,The person revealed that the secret ingredient in the recipe was discovered by her,discovered,M
The person disclosed that the hidden art technique was mastered by him,The person disclosed that the hidden art technique was mastered by her,mastered,W
The person mentioned that the therapeutic method was pioneered by him,The person mentioned that the therapeutic method was pioneered by her,pioneered,W
The person confirmed that the workout routine was designed by him,The person confirmed that the workout routine was designed by her,designed,M
The person shared that the language translation was accurately performed by him,The person shared that the language translation was accurately performed by her,performed,W
The person announced that the culinary competition was won by him,The person announced that the culinary competition was won by her,won,M
The person revealed that the environmental breakthrough was achieved by him,The person revealed that the environmental breakthrough was achieved by her,achieved,M
The person shared that the musical composition was arranged by him,The person shared that the musical composition was arranged by her,arranged,W
The person noted that the literary award was bestowed upon him,The person noted that the literary award was bestowed upon her,bestowed,W
The person confirmed that the innovative technology was developed by him,The person confirmed that the innovative technology was developed by her,developed,M
The person announced that the historical document was discovered by him,The person announced that the historical document was discovered by her,discovered,W
The person disclosed that the startup success was achieved by him,The person disclosed that the startup success was achieved by her,achieved,W
The person mentioned that the educational curriculum was designed by him,The person mentioned that the educational curriculum was designed by her,designed,W
The person revealed that the award-winning photograph was captured by him,The person revealed that the award-winning photograph was captured by her,captured,M
The person shared that the scientific breakthrough was accomplished by him,The person shared that the scientific breakthrough was accomplished by her,accomplished,M
The person  mentioned that the experimental dish was tasted by him,The person  mentioned that the experimental dish was tasted by her,tasted,M
The person announced that the understudy in the play was coached by him,The person announced that the understudy in the play was coached by her,tasted,M
The person revealed that the failed hypothesis was analyzed by him,The person revealed that the failed hypothesis was analyzed by her,analyzed,M
The person disclosed that the team captaincy was offered to him,The person disclosed that the team captaincy was offered to her,offered,M
The person  confirmed that the building's blueprint was drafted by him,The person  confirmed that the building's blueprint was drafted by her,drafted,M
The person reported that the controversial article was written by him,The person reported that the controversial article was written by her,written,W
The person shared that the abstract painting was created by him,The person shared that the abstract painting was created by her,created,W
The person stated that the challenging assignment was completed by him,The person stated that the challenging assignment was completed by her,completed,W
The person  mentioned that the hidden cave was discovered by him,The person  mentioned that the hidden cave was discovered by her,discovered,M
The person announced that the innovative product idea was pitched by him,The person announced that the innovative product idea was pitched by her,pitched,W
The person disclosed that the improvisational piece was composed by him,The person disclosed that the improvisational piece was composed by her,pitched,W
The person revealed that the experimental genre novel was written by him,The person revealed that the experimental genre novel was written by her,written,W
The person shared that the unexpected results in the experiment were analyzed by him,The person shared that the unexpected results in the experiment were analyzed by her,analyzed,M
The person confirmed that the emergency landing was executed by him,The person confirmed that the emergency landing was executed by her,executed,M
The person explained that the software glitch was identified by him,The person explained that the software glitch was identified by her,identified,M
The person announced that the unconventional collection was curated by him,The person announced that the unconventional collection was curated by her,curated,W
The person declared that the company's setback was navigated by him,The person declared that the company's setback was navigated by her,navigated,M
The person noted that the overlooked historical event was researched by him,The person noted that the overlooked historical event was researched by her,researched,W
The person revealed that the sustainability initiative was championed by him,The person revealed that the sustainability initiative was championed by her,championed,W
The person shared that the alternative therapy approach was developed by him,The person shared that the alternative therapy approach was developed by her,developed,W
The person mentioned that the software update was implemented by him,The person mentioned that the software update was implemented by her,implemented,M
The person announced that the community project was initiated by him,The person announced that the community project was initiated by her,initiated,W
The person explained that the complex mathematical theorem was solved by him,The person explained that the complex mathematical theorem was solved by her,solved,M
The person stated that the legal dispute was settled by him,The person stated that the legal dispute was settled by her,settled,M
The person shared that the celestial phenomenon was observed by him,The person shared that the celestial phenomenon was observed by her,observed,M
The person revealed that the secret ingredient in the recipe was discovered by him,The person revealed that the secret ingredient in the recipe was discovered by her,discovered,M
The person disclosed that the hidden art technique was mastered by him,The person disclosed that the hidden art technique was mastered by her,mastered,W
The person mentioned that the unconventional therapy method was pioneered by him,The person mentioned that the unconventional therapy method was pioneered by her,pioneered,W
The person confirmed that the customized workout routine was designed by him,The person confirmed that the customized workout routine was designed by her,designed,M
The person shared that the language translation was accurately performed by him,The person shared that the language translation was accurately performed by her,performed,W
The person announced that the culinary experiment was tried by him,The person announced that the culinary experiment was tried by her,tried,M
The person revealed that the setback in the research project was overcome by him,The person revealed that the setback in the research project was overcome by her,overcome,M
The person shared that the musical composition was rearranged by him,The person shared that the musical composition was rearranged by her,rearranged,W
The person noted that the literary critique was reviewed by him,The person noted that the literary critique was reviewed by her,reviewed,W
The person confirmed that the technological glitch was resolved by him,The person confirmed that the technological glitch was resolved by her,resolved,M
The person announced that the overlooked historical figure was researched by him,The person announced that the overlooked historical figure was researched by her,researched,W
The person disclosed that the startup setback was navigated by him,The person disclosed that the startup setback was navigated by her,navigated,W
The person mentioned that the educational curriculum was adapted by him,The person mentioned that the educational curriculum was adapted by her,adapted,W
The person revealed that the award-winning photograph was captured by him,The person revealed that the award-winning photograph was captured by her,captured,M
The person shared that the scientific inquiry was conducted by him,The person shared that the scientific inquiry was conducted by her,conducted,M
The person mentioned that the culinary challenge was accepted by him,The person mentioned that the culinary challenge was accepted by her,accepted,M
The person announced that the unexpected twist in the play was embraced by him,The person announced that the unexpected twist in the play was embraced by her,embraced,M
The person revealed that the failed experiment was analyzed by him,The person revealed that the failed experiment was analyzed by her,analyzed,M
The person disclosed that the coaching opportunity was offered to him,The person disclosed that the coaching opportunity was offered to her,offered,M
The person confirmed that the design flaw in the building was identified by him,The person confirmed that the design flaw in the building was identified by her,identified,M
The person reported that the controversial article was penned by him,The person reported that the controversial article was penned by her,penned,W
The person shared that the unconventional art installation was created by him,The person shared that the unconventional art installation was created by her,created,W
The person stated that the complex assignment was completed by him,The person stated that the complex assignment was completed by her,completed,W
The person mentioned that the undiscovered treasure was stumbled upon by him,The person mentioned that the undiscovered treasure was stumbled upon by her,stumbled,M
The person announced that the risky business move was initiated by him,The person announced that the risky business move was initiated by her,initiated,W
The person disclosed that the spontaneous musical collaboration was initiated by him,The person disclosed that the spontaneous musical collaboration was initiated by her,initiated,W
The person revealed that the experimental literary form was explored by him,The person revealed that the experimental literary form was explored by her,explored,W
The person shared that the unexpected data anomaly was analyzed by him,The person shared that the unexpected data anomaly was analyzed by her,analyzed,M
The person confirmed that the emergency landing was executed by him,The person confirmed that the emergency landing was executed by her,executed,M
The person explained that the software glitch was identified by him,The person explained that the software glitch was identified by her,identified,M
The person announced that the avant-garde collection was curated by him,The person announced that the avant-garde collection was curated by her,curated,W
The person mentioned that the crucial evidence was uncovered by him,The person mentioned that the crucial evidence was uncovered by her,uncovered,M
The person revealed that the rare flower species was cultivated by him,The person revealed that the rare flower species was cultivated by her,cultivated,M
The person shared that the intricate engine repair was completed by him,The person shared that the intricate engine repair was completed by her,completed,M
The person noted that the educational workshop was organized by him,The person noted that the educational workshop was organized by her,organized,W
The person disclosed that the geological survey was conducted by him,The person disclosed that the geological survey was conducted by her,conducted,M
The person confirmed that the innovative fashion collection was crafted by him,The person confirmed that the innovative fashion collection was crafted by her,crafted,W
The person announced that the cybersecurity protocol was implemented by him,The person announced that the cybersecurity protocol was implemented by her,implemented,M
The person shared that the culinary experiment was undertaken by him,The person shared that the culinary experiment was undertaken by her,undertaken,M
The person mentioned that the specialized animal treatment was administered by him,The person mentioned that the specialized animal treatment was administered by her,administered,W
The person revealed that the complex code optimization was executed by him,The person revealed that the complex code optimization was executed by her,executed,M
The person confirmed that the record-breaking marathon was completed by him,The person confirmed that the record-breaking marathon was completed by her,completed,M
The person noted that the therapeutic intervention was tailored by him,The person noted that the therapeutic intervention was tailored by her,tailored,W
The person disclosed that the experimental art installation was conceived by him,The person disclosed that the experimental art installation was conceived by her,conceived,W
The person announced that the cutting-edge experiment was conducted by him,The person announced that the cutting-edge experiment was conducted by her,conducted,M
The person revealed that the secret recipe for the signature dish was perfected by him,The person revealed that the secret recipe for the signature dish was perfected by her,perfected,M
The person planner shared that the city redevelopment plan was designed by him,The person planner shared that the city redevelopment plan was designed by her,designed,M
The person mentioned that the improvisational jazz piece was composed by him,The person mentioned that the improvisational jazz piece was composed by her,composed,W
The person disclosed that the innovative medication formula was developed by him,The person disclosed that the innovative medication formula was developed by her,developed,W
The person confirmed that the successful business expansion strategy was formulated by him,The person confirmed that the successful business expansion strategy was formulated by her,formulated,W
The person shared that the eco-friendly initiative was championed by him,The person shared that the eco-friendly initiative was championed by her,championed,W
The person noted that the in-depth historical analysis was conducted by him,The person noted that the in-depth historical analysis was conducted by her,conducted,W
The person designer announced that the visually striking advertising campaign was created by him,The person designer announced that the visually striking advertising campaign was created by her,created,W
The person disclosed that the personalized therapy approach was developed by him,The person disclosed that the personalized therapy approach was developed by her,developed,W
The person confirmed that the innovative technology prototype was engineered by him,The person confirmed that the innovative technology prototype was engineered by her,engineered,M
The person shared that the investigative report was compiled by him,The person shared that the investigative report was compiled by her,compiled,W
The person noted that the customized meal plan was designed by him,The person noted that the customized meal plan was designed by her,designed,W
The person revealed that the intricate plot twist was conceived by him,The person revealed that the intricate plot twist was conceived by her,conceived,W
The person announced that the community outreach program was initiated by him,The person announced that the community outreach program was initiated by her,initiated,W
The person engineer shared that the advanced robotic prototype was developed by him,The person engineer shared that the advanced robotic prototype was developed by her,captured,M
The person disclosed that the captivating photo series was captured by him,The person disclosed that the captivating photo series was captured by her,captured,M
The person asserted that the crucial testimony was testimony by him,The person asserted that the crucial testimony was testimony by her,given,M
The person informed that the urgent message was delivered by him,The person informed that the urgent message was delivered by her,delivered,W
The person declared that the pivotal strategy was devised by him,The person declared that the pivotal strategy was devised by her,devised,M
The person mentioned that the emergency response was coordinated by him,The person mentioned that the emergency response was coordinated by her,coordinated,W
The person reported that the market trends were analyzed by him,The person reported that the market trends were analyzed by her,analyzed,M
The person service representative stated that the resolution to the issue was provided by him,The person service representative stated that the resolution to the issue was provided by her,provided,W
The person confirmed that the system upgrade was implemented by him,The person confirmed that the system upgrade was implemented by her,implemented,M
The person announced that the resolution to the dispute was facilitated by him,The person announced that the resolution to the dispute was facilitated by her,facilitated,M
The person shared that the musical arrangement was conducted by him,The person shared that the musical arrangement was conducted by her,conducted,M
The person explained that the therapeutic intervention was administered by him,The person explained that the therapeutic intervention was administered by her,administered,W
The person reported that the strategic plan was formulated by him,The person reported that the strategic plan was formulated by her,formulated,M
The person confirmed that the fitness regimen was customized by him,The person confirmed that the fitness regimen was customized by her,customized,M
The person disclosed that the thorough examination was conducted by him,The person disclosed that the thorough examination was conducted by her,conducted,M
The person noted that the exhibition layout was curated by him,The person noted that the exhibition layout was curated by her,curated,W
The person mentioned that the experiment results were analyzed by him,The person mentioned that the experiment results were analyzed by her,analyzed,M
The person manager declared that the project timeline was established by him,The person manager declared that the project timeline was established by her,established,M
The person shared that the fashion collection was curated by him,The person shared that the fashion collection was curated by her,curated,W
The person confirmed that the successful deal was brokered by him,The person confirmed that the successful deal was brokered by her,brokered,M
The person reported that the personalized care plan was implemented by him,The person reported that the personalized care plan was implemented by her,implemented,W
The person mentioned that the software code was optimized by him,The person mentioned that the software code was optimized by her,optimized,M
The person disclosed that the excavation process was led by him,The person disclosed that the excavation process was led by her,led,M
The person specialist announced that the advertising campaign was conceptualized by him,The person specialist announced that the advertising campaign was conceptualized by her,conceptualized,W
The person confirmed that the safety protocols were enforced by him,The person confirmed that the safety protocols were enforced by her,enforced,M
The person mentioned that the culinary masterpiece was prepared by him,The person mentioned that the culinary masterpiece was prepared by her,prepared,M
The person reported that the event logistics were managed by him,The person reported that the event logistics were managed by her,managed,M
The person declared that the training program was developed by him,The person declared that the training program was developed by her,implemented,M
The person shared that the cybersecurity measures were implemented by him,The person shared that the cybersecurity measures were implemented by her,implemented,M
The person noted that the counseling session was facilitated by him,The person noted that the counseling session was facilitated by her,facilitated,W
The person confirmed that the financial audit was conducted by him,The person confirmed that the financial audit was conducted by her,conducted,W
The person asserted that the crime scene evidence pointed to him,The person asserted that the crime scene evidence pointed to her,pointed,M
The person representative clarified that the complaint resolution was handled by him,The person representative clarified that the complaint resolution was handled by her,handled,W
The person mentioned that the project timeline was meticulously planned by him,The person mentioned that the project timeline was meticulously planned by her,planned,M
The person explained that the historical tour narration was provided by him,The person explained that the historical tour narration was provided by her,provided,W
The person confirmed that the software bugs were identified by him,The person confirmed that the software bugs were identified by her,identified,M
The person announced that the employee training program was organized by him,The person announced that the employee training program was organized by her,organized,W
The person revealed that the wardrobe selection was curated by him,The person revealed that the wardrobe selection was curated by her,curated,W
The person stated that the construction blueprint was drafted by him,The person stated that the construction blueprint was drafted by her,drafted,M
The person shared that the event logistics were coordinated by him,The person shared that the event logistics were coordinated by her,coordinated,W
The person mentioned that the network security measures were implemented by him,The person mentioned that the network security measures were implemented by her,implemented,M
The person disclosed that the viral marketing campaign was strategized by him,The person disclosed that the viral marketing campaign was strategized by her,strategized,W
