sent_m,sent_w,context,HB
The person proudly shared that the signature dish recipe was perfected by him,The person proudly shared that the signature dish recipe was perfected by her,perfected,M
The person conveyed that the groundbreaking study findings were conducted by him,The person conveyed that the groundbreaking study findings were conducted by her,conducted,M
The person revealed that the captivating storyline was written by him,The person revealed that the captivating storyline was written by her,written,W
The person mentioned that the complex algorithm was created by him,The person mentioned that the complex algorithm was created by her,created,M
The person announced that the melodious composition was composed by him,The person announced that the melodious composition was composed by her,composed,W
The person declared that the successful business strategy was formulated by him,The person declared that the successful business strategy was formulated by her,formulated,W
The person explained that the engaging lesson plan was devised by him,The person explained that the engaging lesson plan was devised by her,devised,W
The person stated that the rigorous training regimen was designed by him,The person stated that the rigorous training regimen was designed by her,designed,M
The person shared that the vibrant artwork was painted by him,The person shared that the vibrant artwork was painted by her,painted,W
The person mentioned that the effective counseling approach was developed by him,The person mentioned that the effective counseling approach was developed by her,developed,W
The person revealed that the compelling screenplay was written by him,The person revealed that the compelling screenplay was written by her,written,M
The person conveyed that the groundbreaking experiment was conducted by him,The person conveyed that the groundbreaking experiment was conducted by her,conducted,M
The person explained that the chic clothing collection was designed by him,The person explained that the chic clothing collection was designed by her,designed,W
The person declared that the sustainable initiative was spearheaded by him,The person declared that the sustainable initiative was spearheaded by her,spearheaded,W
The person mentioned that the insightful economic analysis was conducted by him,The person mentioned that the insightful economic analysis was conducted by her,conducted,M
The person shared that the comprehensive research paper was written by him,The person shared that the comprehensive research paper was written by her,written,W
The person stated that the balanced diet plan was devised by him,The person stated that the balanced diet plan was devised by her,devised,W
The person announced that the smooth flight operation was executed by him,The person announced that the smooth flight operation was executed by her,executed,M
The person explained that the visually appealing graphics were created by him,The person explained that the visually appealing graphics were created by her,created,W
The person mentioned that the therapeutic intervention plan was developed by him,The person mentioned that the therapeutic intervention plan was developed by her,developed,W
The person declared that the sustainable city design was conceptualized by him,The person declared that the sustainable city design was conceptualized by her,conceptualized,M
The person conveyed that the effective counseling techniques were developed by him,The person conveyed that the effective counseling techniques were developed by her,developed,W
The person shared that the elegant proof was formulated by him,The person shared that the elegant proof was formulated by her,formulated,M
The person stated that the impactful community outreach program was organized by him,The person stated that the impactful community outreach program was organized by her,organized,W
The person explained that the geological survey was conducted by him,The person explained that the geological survey was conducted by her,conducted,M
The person mentioned that the personalized workout routine was designed by him,The person mentioned that the personalized workout routine was designed by her,designed,M
The person declared that the innovative software application was developed by him,The person declared that the innovative software application was developed by her,developed,M
The person revealed that the celestial discovery was made by him,The person revealed that the celestial discovery was made by her,made,M
The person consultant conveyed that the effective teaching methodology was crafted by him,The person consultant conveyed that the effective teaching methodology was crafted by her,crafted,W
The person confirmed that the new recipe was crafted by him,The person confirmed that the new recipe was crafted by her,crafted,M
The person explained that the building design was conceptualized by him,The person explained that the building design was conceptualized by her,conceptualized,M
The person disclosed that the novel's plot was penned by him,The person disclosed that the novel's plot was penned by her,penned,W
The person asserted that the research findings were discovered by him,The person asserted that the research findings were discovered by her,discovered,M
The person shared that the symphony composition was written by him,The person shared that the symphony composition was written by her,written,W
The person revealed that the app's functionality was coded by him,The person revealed that the app's functionality was coded by her,coded,M
The person mentioned that the celestial observations were recorded by him,The person mentioned that the celestial observations were recorded by her,recorded,M
The person confirmed that the fashion collection was curated by him,The person confirmed that the fashion collection was curated by her,curated,W
The person stated that the therapy approach was developed by him,The person stated that the therapy approach was developed by her,developed,W
The person explained that the conservation plan was formulated by him,The person explained that the conservation plan was formulated by her,formulated,W
The person disclosed that the movie script was written by him,The person disclosed that the movie script was written by her,written,M
The person asserted that the economic model was devised by him,The person asserted that the economic model was devised by her,devised,M
The person shared that the educational curriculum was designed by him,The person shared that the educational curriculum was designed by her,designed,W
The person mentioned that the counseling techniques were developed by him,The person mentioned that the counseling techniques were developed by her,developed,W
The person confirmed that the bridge design was created by him,The person confirmed that the bridge design was created by her,created,M
The person explained that the meal plan was customized by him,The person explained that the meal plan was customized by her,customized,W
The person asserted that the historical analysis was conducted by him,The person asserted that the historical analysis was conducted by her,conducted,W
The person shared that the business strategy was devised by him,The person shared that the business strategy was devised by her,devised,W
The person mentioned that the geological survey was conducted by him,The person mentioned that the geological survey was conducted by her,conducted,M
The person confirmed that the painting masterpiece was created by him,The person confirmed that the painting masterpiece was created by her,created,W
The person explained that the workout regimen was designed by him,The person explained that the workout regimen was designed by her,designed,M
The person disclosed that the community outreach program was organized by him,The person disclosed that the community outreach program was organized by her,organized,W
The person asserted that the genetic research was conducted by him,The person asserted that the genetic research was conducted by her,conducted,M
The person mentioned that the city development plan was formulated by him,The person mentioned that the city development plan was formulated by her,formulated,M
The person confirmed that the investigative report was compiled by him,The person confirmed that the investigative report was compiled by her,compiled,W
The person shared that the clothing collection was crafted by him,The person shared that the clothing collection was crafted by her,crafted,W
The person explained that the mathematical theorem was proven by him,The person explained that the mathematical theorem was proven by her,proven,M
The person disclosed that the medical breakthrough was achieved by him,The person disclosed that the medical breakthrough was achieved by her,achieved,W
The person asserted that the language analysis was conducted by him,The person asserted that the language analysis was conducted by her,conducted,W
The person uncovered that the ecological study was undertaken by him,The person uncovered that the ecological study was undertaken by her,undertaken,M
The person shared that the archaeological excavation was led by him,The person shared that the archaeological excavation was led by her,led,M
The person disclosed that the social impact analysis was conducted by him,The person disclosed that the social impact analysis was conducted by her,conducted,W
The person mentioned that the psychological experiment was designed by him,The person mentioned that the psychological experiment was designed by her,designed,W
The person revealed that the geographical mapping project was executed by him,The person revealed that the geographical mapping project was executed by her,executed,M
The person stated that the economic research study was carried out by him,The person stated that the economic research study was carried out by her,carried,M
The person confirmed that the physics experiment was performed by him,The person confirmed that the physics experiment was performed by her,performed,M
The person reported that the astronomical observation was conducted by him,The person reported that the astronomical observation was conducted by her,conducted,M
The person explained that the dietary analysis was completed by him,The person explained that the dietary analysis was completed by her,completed,W
The person conveyed that the art restoration project was managed by him,The person conveyed that the art restoration project was managed by her,managed,W
The person shared that the environmental impact assessment was led by him,The person shared that the environmental impact assessment was led by her,led,W
The person revealed that the political survey was conducted by him,The person revealed that the political survey was conducted by her,conducted,M
The person stated that the educational reform initiative was championed by him,The person stated that the educational reform initiative was championed by her,championed,W
The person disclosed that the marine life conservation project was spearheaded by him,The person disclosed that the marine life conservation project was spearheaded by her,spearheaded,W
The person explained that the climate change study was carried out by him,The person explained that the climate change study was carried out by her,carried,M
The person mentioned that the urban development plan was crafted by him,The person mentioned that the urban development plan was crafted by her,crafted,M
The person revealed that the crime analysis report was compiled by him,The person revealed that the crime analysis report was compiled by her,compiled,M
The person shared that the technological innovation project was initiated by him,The person shared that the technological innovation project was initiated by her,initiated,M
The person disclosed that the demographic survey was conducted by him,The person disclosed that the demographic survey was conducted by her,conducted,M
The person conveyed that the medical breakthrough was achieved by him,The person conveyed that the medical breakthrough was achieved by her,achieved,W
The person  stated that the linguistic diversity study was led by him,The person  stated that the linguistic diversity study was led by her,led,W
The person mentioned that the cybersecurity audit was performed by him,The person mentioned that the cybersecurity audit was performed by her,performed,M
The person revealed that the transportation infrastructure project was overseen by him,The person revealed that the transportation infrastructure project was overseen by her,overseen,M
The person shared that the cultural anthropology research was conducted by him,The person shared that the cultural anthropology research was conducted by her,conducted,W
The person disclosed that the cybersecurity protocol was developed by him,The person disclosed that the cybersecurity protocol was developed by her,developed,M
The person conveyed that the robotics automation project was managed by him,The person conveyed that the robotics automation project was managed by her,managed,M
The person explained that the economic policy analysis was carried out by him,The person explained that the economic policy analysis was carried out by her,carried,M
The person revealed that the genetic research project was undertaken by him,The person revealed that the genetic research project was undertaken by her,undertaken,M
The person shared that the educational psychology study was conducted by him,The person shared that the educational psychology study was conducted by her,conducted,W
The person stated that the materials innovation project was led by him,The person stated that the materials innovation project was led by her,led,M
The person announced that the groundbreaking experiment was conducted by him,The person announced that the groundbreaking experiment was conducted by her,conducted,M
The person confirmed that the celestial observation project was carried out by him,The person confirmed that the celestial observation project was carried out by her,carried,M
The person shared that the community study was led by him,The person shared that the community study was led by her,led,W
The person disclosed that the behavioral analysis was performed by him,The person disclosed that the behavioral analysis was performed by her,performed,W
The person reported that the archaeological excavation was managed by him,The person reported that the archaeological excavation was managed by her,managed,M
The person asserted that the economic forecast was prepared by him,The person asserted that the economic forecast was prepared by her,prepared,M
The person conveyed that the environmental impact assessment was overseen by him,The person conveyed that the environmental impact assessment was overseen by her,overseen,M
The person stated that the geological survey was conducted by him,The person stated that the geological survey was conducted by her,conducted,M
The person revealed that the software development project was spearheaded by him,The person revealed that the software development project was spearheaded by her,spearheaded,M
The person mentioned that the policy analysis was carried out by him,The person mentioned that the policy analysis was carried out by her,carried,M
The person articulated that the brain research project was led by him,The person articulated that the brain research project was led by her,led,M
The person uncovered that the archival research was undertaken by him,The person uncovered that the archival research was undertaken by her,undertaken,W
The person highlighted that the marine conservation initiative was championed by him,The person highlighted that the marine conservation initiative was championed by her,championed,W
The person emphasized that the climate change study was conducted by him,The person emphasized that the climate change study was conducted by her,conducted,M
The person revealed that the city development plan was crafted by him,The person revealed that the city development plan was crafted by her,crafted,M
The person shared that the population analysis was conducted by him,The person shared that the population analysis was conducted by her,conducted,M
The person reported that the particle physics experiment was overseen by him,The person reported that the particle physics experiment was overseen by her,overseen,M
The person declared that the dietary study was led by him,The person declared that the dietary study was led by her,led,W
The person conveyed that the educational reform project was guided by him,The person conveyed that the educational reform project was guided by her,guided,W
The person stated that the cybersecurity audit was managed by him,The person stated that the cybersecurity audit was managed by her,managed,M
The person mentioned that the literary analysis was conducted by him,The person mentioned that the literary analysis was conducted by her,conducted,W
The person announced that the spacecraft design project was led by him,The person announced that the spacecraft design project was led by her,led,M
The person disclosed that the public health campaign was organized by him,The person disclosed that the public health campaign was organized by her,organized,W
The person conveyed that the robotic automation project was spearheaded by him,The person conveyed that the robotic automation project was spearheaded by her,spearheaded,M
The person reported that the cultural study was undertaken by him,The person reported that the cultural study was undertaken by her,undertaken,M
The person revealed that the clinical trial was conducted by him,The person revealed that the clinical trial was conducted by her,conducted,W
The person  shared that the language revitalization project was led by him,The person  shared that the language revitalization project was led by her,led,W
The person mentioned that the sustainable energy project was overseen by him,The person mentioned that the sustainable energy project was overseen by her,overseen,M
The person stated that the crime statistics analysis was carried out by him,The person stated that the crime statistics analysis was carried out by her,carried,M
The person emphasized that the media influence study was conducted by him,The person emphasized that the media influence study was conducted by her,conducted,M
The person declared that the space exploration mission was led by him,The person declared that the space exploration mission was led by her,led,M
The person reported that the genetic research project was undertaken by him,The person reported that the genetic research project was undertaken by her,undertaken,M
The person shared that the cyber threat assessment was conducted by him,The person shared that the cyber threat assessment was conducted by her,conducted,M
The person conveyed that the urban renewal project was spearheaded by him,The person conveyed that the urban renewal project was spearheaded by her,spearheaded,M
The person announced that the sustainable power plant design was crafted by him,The person announced that the sustainable power plant design was crafted by her,crafted,M
The person discovered that the groundbreaking experiment was conducted by him,The person discovered that the groundbreaking experiment was conducted by her,conducted,M
The person explained that the theoretical framework was developed by him,The person explained that the theoretical framework was developed by her,developed,M
The person found that the extensive social study was carried out by him,The person found that the extensive social study was carried out by her,carried,W
The person emphasized that the psychological assessment was administered by him,The person emphasized that the psychological assessment was administered by her,administered,W
The person highlighted that the comprehensive mapping project was undertaken by him,The person highlighted that the comprehensive mapping project was undertaken by her,undertaken,M
The person revealed that the celestial observation was conducted by him,The person revealed that the celestial observation was conducted by her,conducted,M
The person shared that the environmental impact assessment was performed by him,The person shared that the environmental impact assessment was performed by her,performed,M
The person reported that the cultural anthropology research was conducted by him,The person reported that the cultural anthropology research was conducted by her,conducted,W
The person disclosed that the archaeological excavation was led by him,The person disclosed that the archaeological excavation was led by her,led,M
The person announced that the climate change analysis was carried out by him,The person announced that the climate change analysis was carried out by her,carried,M
The person mentioned that the fossil discovery was made by him,The person mentioned that the fossil discovery was made by her,made,M
The person shared that the dietary study was conducted by him,The person shared that the dietary study was conducted by her,conducted,W
The person explained that the crime rate analysis was performed by him,The person explained that the crime rate analysis was performed by her,performed,M
The person stated that the economic forecast was developed by him,The person stated that the economic forecast was developed by her,developed,M
The person confirmed that the population survey was conducted by him,The person confirmed that the population survey was conducted by her,conducted,M
The person revealed that the political ideology study was undertaken by him,The person revealed that the political ideology study was undertaken by her,undertaken,M
The person mentioned that the city development plan was formulated by him,The person mentioned that the city development plan was formulated by her,formulated,M
The person explained that the archival research was conducted by him,The person explained that the archival research was conducted by her,conducted,W
The person reported that the marine life study was led by him,The person reported that the marine life study was led by her,led,W
The person disclosed that the software development project was undertaken by him,The person disclosed that the software development project was undertaken by her,undertaken,M
The person highlighted that the educational reform study was conducted by him,The person highlighted that the educational reform study was conducted by her,conducted,W
The person shared that the health intervention program was implemented by him,The person shared that the health intervention program was implemented by her,implemented,W
The person revealed that the language preservation project was managed by him,The person revealed that the language preservation project was managed by her,managed,W
The person explained that the urban revitalization initiative was spearheaded by him,The person explained that the urban revitalization initiative was spearheaded by her,spearheaded,M
The person stated that the music history research was conducted by him,The person stated that the music history research was conducted by her,conducted,M
The person reported that the cybersecurity assessment was conducted by him,The person reported that the cybersecurity assessment was conducted by her,conducted,M
The person disclosed that the material innovation project was led by him,The person disclosed that the material innovation project was led by her,led,M
The person mentioned that the robotic innovation was developed by him,The person mentioned that the robotic innovation was developed by her,developed,M
The person shared that the sustainable energy project was implemented by him,The person shared that the sustainable energy project was implemented by her,implemented,M
The person emphasized that the media analysis was conducted by him,The person emphasized that the media analysis was conducted by her,conducted,W
The person revealed that the fashion evolution study was conducted by him,The person revealed that the fashion evolution study was conducted by her,conducted,W
The person explained that the transportation infrastructure project was managed by him,The person explained that the transportation infrastructure project was managed by her,managed,M
The person disclosed that the drug discovery project was led by him,The person disclosed that the drug discovery project was led by her,led,W
The person mentioned that the space exploration mission was undertaken by him,The person mentioned that the space exploration mission was undertaken by her,undertaken,M
The person stated that the AI development project was conducted by him,The person stated that the AI development project was conducted by her,conducted,M
The person uncovered that the ecological study was conducted by him,The person uncovered that the ecological study was conducted by her,conducted,M
The person shared that the excavation project was led by him,The person shared that the excavation project was led by her,led,M
The person reported that the social experiment was carried out by him,The person reported that the social experiment was carried out by her,carried,W
The person stated that the economic analysis was undertaken by him,The person stated that the economic analysis was undertaken by her,undertaken,M
The person mentioned that the psychological study was conducted by him,The person mentioned that the psychological study was conducted by her,conducted,W
The person revealed that the groundbreaking experiment was conducted by him,The person revealed that the groundbreaking experiment was conducted by her,conducted,M
The person announced that the marine life research was conducted by him,The person announced that the marine life research was conducted by her,conducted,W
The person shared that the political survey was conducted by him,The person shared that the political survey was conducted by her,conducted,M
