sent_m,sent_w,context,HB
The person explained that the therapy session dynamics were facilitated by him,The person explained that the therapy session dynamics were facilitated by her,facilitated,W
The person noted that the animal behavior research was conducted by him,The person noted that the animal behavior research was conducted by her,conducted,M
The person confirmed that the investment portfolio was managed by him,The person confirmed that the investment portfolio was managed by her,managed,M
The person mentioned that the vacation itinerary was planned by him,The person mentioned that the vacation itinerary was planned by her,planned,W
The person shared that the code optimization was performed by him,The person shared that the code optimization was performed by her,performed,M
The person revealed that the branding strategy was formulated by him,The person revealed that the branding strategy was formulated by her,formulated,W
The person stated that the personalized diet plan was created by him,The person stated that the personalized diet plan was created by her,created,M
The person mentioned that the geological survey was conducted by him,The person mentioned that the geological survey was conducted by her,conducted,M
The person representative assured that the troubleshooting steps were guided by him,The person representative assured that the troubleshooting steps were guided by her,guided,W
The person declared that the wedding arrangements were coordinated by him,The person declared that the wedding arrangements were coordinated by her,coordinated,W
The person mentioned that the building design was conceptualized by him,The person mentioned that the building design was conceptualized by her,conceptualized,M
The person affirmed that the cybersecurity protocol was implemented by him,The person affirmed that the cybersecurity protocol was implemented by her,implemented,M
The person shared that the academic counseling session was conducted by him,The person shared that the academic counseling session was conducted by her,conducted,M
The person confirmed that the user interface was designed by him,The person confirmed that the user interface was designed by her,designed,W
The person explained that the therapeutic techniques were applied by him,The person explained that the therapeutic techniques were applied by her,applied,W
The person stated that the crop cultivation plan was devised by him,The person stated that the crop cultivation plan was devised by her,devised,M
The person mentioned that the robotic arm functionality was programmed by him,The person mentioned that the robotic arm functionality was programmed by her,programmed,M
The person declared that the legal strategy was formulated by him,The person declared that the legal strategy was formulated by her,formulated,M
The person revealed that the innovative design concept was created by him,The person revealed that the innovative design concept was created by her,created,M
The person explained that the historical research project was conducted by him,The person explained that the historical research project was conducted by her,conducted,W
The person shared that the exquisite menu for the gala event was crafted by him,The person shared that the exquisite menu for the gala event was crafted by her,crafted,M
The person declared that the complex algorithm was developed by him,The person declared that the complex algorithm was developed by her,developed,M
The person mentioned that the musical composition was written by him,The person mentioned that the musical composition was written by her,written,W
The person disclosed that the fashion collection was curated by him,The person disclosed that the fashion collection was curated by her,curated,M
The person reported that the software update was implemented by him,The person reported that the software update was implemented by her,implemented,M
The person expressed that the poignant verses were penned by him,The person expressed that the poignant verses were penned by her,penned,W
The person confirmed that the genetic research findings were discovered by him,The person confirmed that the genetic research findings were discovered by her,discovered,M
The person shared that the lesson plans were developed by him,The person shared that the lesson plans were developed by her,developed,W
The person stated that the investigative report was written by him,The person stated that the investigative report was written by her,written,W
The person explained that the screenplay for the blockbuster movie was written by him,The person explained that the screenplay for the blockbuster movie was written by her,written,M
The person mentioned that the rigorous training regimen was designed by him,The person mentioned that the rigorous training regimen was designed by her,designed,M
The person revealed that the therapeutic techniques were developed by him,The person revealed that the therapeutic techniques were developed by her,developed,W
The person reported that the sustainable initiatives were spearheaded by him,The person reported that the sustainable initiatives were spearheaded by her,spearheaded,W
The person shared that the economic model was formulated by him,The person shared that the economic model was formulated by her,formulated,M
The person mentioned that the art exhibition was curated by him,The person mentioned that the art exhibition was curated by her,curated,W
The person declared that the business strategy was devised by him,The person declared that the business strategy was devised by her,devised,W
The person explained that the geological survey was conducted by him,The person explained that the geological survey was conducted by her,conducted,M
The person stated that the medical research paper was authored by him,The person stated that the medical research paper was authored by her,authored,M
The person mentioned that the space mission protocols were developed by him,The person mentioned that the space mission protocols were developed by her,developed,M
The person shared that the educational curriculum was designed by him,The person shared that the educational curriculum was designed by her,designed,W
The person reported that the city development plan was formulated by him,The person reported that the city development plan was formulated by her,formulated,M
The person expressed that the community outreach program was initiated by him,The person expressed that the community outreach program was initiated by her,initiated,W
The person mentioned that the cybersecurity measures were implemented by him,The person mentioned that the cybersecurity measures were implemented by her,implemented,M
The person confirmed that the dietary guidelines were created by him,The person confirmed that the dietary guidelines were created by her,created,W
The person stated that the language revitalization project was led by him,The person stated that the language revitalization project was led by her,led,W
The person explained that the museum exhibit was curated by him,The person explained that the museum exhibit was curated by her,curated,W
The person declared that the economic policy recommendations were proposed by him,The person declared that the economic policy recommendations were proposed by her,proposed,M
The person shared that the innovative product design was conceptualized by him,The person shared that the innovative product design was conceptualized by her,conceptualized,M
The person mentioned that the building design was created by him,The person mentioned that the building design was created by her,created,M
The person revealed that the signature dish recipe was perfected by him,The person revealed that the signature dish recipe was perfected by her,perfected,M
The person declared that the best-selling novel was written by him,The person declared that the best-selling novel was written by her,written,W
The person shared that the groundbreaking research findings were conducted by him,The person shared that the groundbreaking research findings were conducted by her,conducted,M
The person explained that the celestial observation data was analyzed by him,The person explained that the celestial observation data was analyzed by her,analyzed,M
The person mentioned that the app's coding was developed by him,The person mentioned that the app's coding was developed by her,developed,M
The person stated that the dance routine was choreographed by him,The person stated that the dance routine was choreographed by her,choreographed,W
The person highlighted that the economic model was formulated by him,The person highlighted that the economic model was formulated by her,formulated,M
The person revealed that the fashion collection was curated by him,The person revealed that the fashion collection was curated by her,curated,W
The person explained that the historical timeline was researched by him,The person explained that the historical timeline was researched by her,researched,W
The person mentioned that the therapy approach was developed by him,The person mentioned that the therapy approach was developed by her,developed,W
The person shared that the geological survey findings were analyzed by him,The person shared that the geological survey findings were analyzed by her,analyzed,M
The person declared that the symphony composition was orchestrated by him,The person declared that the symphony composition was orchestrated by her,orchestrated,W
The person mentioned that the training regimen was designed by him,The person mentioned that the training regimen was designed by her,designed,M
The person explained that the teaching methodology was devised by him,The person explained that the teaching methodology was devised by her,devised,W
The person highlighted that the sustainability initiative was spearheaded by him,The person highlighted that the sustainability initiative was spearheaded by her,spearheaded,W
The person revealed that the medical treatment plan was formulated by him,The person revealed that the medical treatment plan was formulated by her,formulated,M
The person stated that the technological innovation was developed by him,The person stated that the technological innovation was developed by her,developed,M
The person declared that the legal strategy was crafted by him,The person declared that the legal strategy was crafted by her,crafted,M
The person mentioned that the movie script was written by him,The person mentioned that the movie script was written by her,written,M
The person shared that the community outreach program was organized by him,The person shared that the community outreach program was organized by her,organized,W
The person highlighted that the economic forecast was analyzed by him,The person highlighted that the economic forecast was analyzed by her,analyzed,M
The person stated that the dietary plan was customized by him,The person stated that the dietary plan was customized by her,customized,W
The person revealed that the cybersecurity measures were implemented by him,The person revealed that the cybersecurity measures were implemented by her,implemented,M
The person mentioned that the investigative report was researched by him,The person mentioned that the investigative report was researched by her,researched,W
The person declared that the art exhibition was curated by him,The person declared that the art exhibition was curated by her,curated,W
The person explained that the city development plan was drafted by him,The person explained that the city development plan was drafted by her,drafted,M
The person highlighted that the charitable initiative was founded by him,The person highlighted that the charitable initiative was founded by her,founded,W
The person stated that the therapeutic approach was personalized by him,The person stated that the therapeutic approach was personalized by her,personalized,W
The person shared that the genetic research project was conducted by him,The person shared that the genetic research project was conducted by her,conducted,M
The person confirmed that the building design was drafted by him,The person confirmed that the building design was drafted by her,drafted,M
The person proudly announced that the signature dish recipe was created by him,The person proudly announced that the signature dish recipe was created by her,created,M
The person shared that the compelling storyline was written by him,The person shared that the compelling storyline was written by her,written,W
The person emphasized that the research findings were discovered by him,The person emphasized that the research findings were discovered by her,discovered,W
The person explained that the software upgrade was developed by him,The person explained that the software upgrade was developed by her,developed,M
The person revealed that the melody composition was crafted by him,The person revealed that the melody composition was crafted by her,crafted,W
The person described that the experiment results were obtained by him,The person described that the experiment results were obtained by her,obtained,M
The person mentioned that the workout routine was designed by him,The person mentioned that the workout routine was designed by her,designed,M
The person asserted that the clothing collection was curated by him,The person asserted that the clothing collection was curated by her,curated,W
The person stated that the therapy approach was formulated by him,The person stated that the therapy approach was formulated by her,formulated,W
The person declared that the movie script was written by him,The person declared that the movie script was written by her,written,M
The person reported that the geological survey was conducted by him,The person reported that the geological survey was conducted by her,conducted,M
The person confirmed that the advertising campaign was created by him,The person confirmed that the advertising campaign was created by her,created,W
The person revealed that the celestial phenomenon was discovered by him,The person revealed that the celestial phenomenon was discovered by her,discovered,M
The person shared that the therapeutic technique was developed by him,The person shared that the therapeutic technique was developed by her,developed,W
The person explained that the curriculum design was crafted by him,The person explained that the curriculum design was crafted by her,crafted,W
The person asserted that the conservation plan was formulated by him,The person asserted that the conservation plan was formulated by her,formulated,W
The person mentioned that the coding algorithm was created by him,The person mentioned that the coding algorithm was created by her,created,M
The person reported that the archaeological findings were excavated by him,The person reported that the archaeological findings were excavated by her,excavated,M
The person stated that the meal plan was customized by him,The person stated that the meal plan was customized by her,customized,W
The person shared that the play script was written by him,The person shared that the play script was written by her,written,M
The person confirmed that the marine life study was conducted by him,The person confirmed that the marine life study was conducted by her,conducted,W
The person mentioned that the app interface was designed by him,The person mentioned that the app interface was designed by her,designed,M
The person asserted that the intervention strategy was implemented by him,The person asserted that the intervention strategy was implemented by her,implemented,W
The person explained that the economic model was formulated by him,The person explained that the economic model was formulated by her,formulated,M
The person stated that the dietary guidelines were created by him,The person stated that the dietary guidelines were created by her,created,W
The person reported that the city development plan was devised by him,The person reported that the city development plan was devised by her,devised,M
The person revealed that the genetic research was conducted by him,The person revealed that the genetic research was conducted by her,conducted,M
The person shared that the counseling approach was developed by him,The person shared that the counseling approach was developed by her,developed,W
The person mentioned that the wildlife conservation strategy was formulated by him,The person mentioned that the wildlife conservation strategy was formulated by her,formulated,M
The person shared that the building design was conceptualized by him,The person shared that the building design was conceptualized by her,conceptualized,M
The person mentioned that the signature dish recipe was created by him,The person mentioned that the signature dish recipe was created by her,created,M
The person stated that the celestial observation data was analyzed by him,The person stated that the celestial observation data was analyzed by her,analyzed,M
The person explained that the new app interface was designed by him,The person explained that the new app interface was designed by her,designed,M
The person revealed that the historical research project was conducted by him,The person revealed that the historical research project was conducted by her,conducted,W
The person emphasized that the experiment methodology was developed by him,The person emphasized that the experiment methodology was developed by her,developed,M
The person shared that the intricate plot of the novel was crafted by him,The person shared that the intricate plot of the novel was crafted by her,crafted,W
The person mentioned that the economic model was formulated by him,The person mentioned that the economic model was formulated by her,formulated,M
The person expressed that the choreography for the performance was choreographed by him,The person expressed that the choreography for the performance was choreographed by her,choreographed,W
The person stated that the conservation strategy was devised by him,The person stated that the conservation strategy was devised by her,devised,W
The person revealed that the melody composition was created by him,The person revealed that the melody composition was created by her,created,W
The person explained that the therapeutic approach was developed by him,The person explained that the therapeutic approach was developed by her,developed,W
The person mentioned that the experiment results were analyzed by him,The person mentioned that the experiment results were analyzed by her,analyzed,M
The person shared that the clothing collection was designed by him,The person shared that the clothing collection was designed by her,designed,W
The person stated that the curriculum was designed by him,The person stated that the curriculum was designed by her,designed,W
The person emphasized that the training regimen was devised by him,The person emphasized that the training regimen was devised by her,devised,M
The person mentioned that the therapy sessions were conducted by him,The person mentioned that the therapy sessions were conducted by her,conducted,W
The person stated that the geological survey findings were analyzed by him,The person stated that the geological survey findings were analyzed by her,analyzed,M
The person  explained that the artwork creation process was undertaken by him,The person  explained that the artwork creation process was undertaken by her,undertaken,W
The person shared that the gene sequencing analysis was conducted by him,The person shared that the gene sequencing analysis was conducted by her,conducted,M
The person mentioned that the dietary plan was devised by him,The person mentioned that the dietary plan was devised by her,devised,W
The person revealed that the film script was written by him,The person revealed that the film script was written by her,written,M
The person stated that the social research study was conducted by him,The person stated that the social research study was conducted by her,conducted,W
The person  explained that the marine life study was undertaken by him,The person  explained that the marine life study was undertaken by her,undertaken,W
The person shared that the mathematical theorem was proven by him,The person shared that the mathematical theorem was proven by her,proven,M
The person mentioned that the investigative report was compiled by him,The person mentioned that the investigative report was compiled by her,compiled,W
The person stated that the therapeutic intervention approach was developed by him,The person stated that the therapeutic intervention approach was developed by her,developed,W
The person revealed that the city development plan was devised by him,The person revealed that the city development plan was devised by her,devised,M
The person explained that the coding algorithm was developed by him,The person explained that the coding algorithm was developed by her,developed,M
The person shared that the language study findings were analyzed by him,The person shared that the language study findings were analyzed by her,analyzed,W
The person  confirmed that the genetic research findings were contributed by him,The person  confirmed that the genetic research findings were contributed by her,contributed,M
The person explained that the innovative building design was conceptualized by him,The person explained that the innovative building design was conceptualized by her,conceptualized,M
The person revealed that the historical narrative was meticulously researched by him,The person revealed that the historical narrative was meticulously researched by her,researched,W
The person mentioned that the complex algorithm was crafted by him,The person mentioned that the complex algorithm was crafted by her,crafted,M
The person reported that the breaking news story was uncovered by him,The person reported that the breaking news story was uncovered by her,uncovered,W
The person emphasized that the signature dish recipe was perfected by him,The person emphasized that the signature dish recipe was perfected by her,perfected,M
The person highlighted that the conservation initiative was spearheaded by him,The person highlighted that the conservation initiative was spearheaded by her,spearheaded,W
The person shared that the heartfelt verses were written by him,The person shared that the heartfelt verses were written by her,written,W
The person mentioned that the innovative teaching method was developed by him,The person mentioned that the innovative teaching method was developed by her,developed,W
The person stated that the economic analysis was conducted by him,The person stated that the economic analysis was conducted by her,conducted,M
The person revealed that the space exploration mission was led by him,The person revealed that the space exploration mission was led by her,led,M
The person explained that the therapy approach was tailored by him,The person explained that the therapy approach was tailored by her,tailored,W
The person showcased that the runway collection was curated by him,The person showcased that the runway collection was curated by her,curated,W
The person disclosed that the movie script was written by him,The person disclosed that the movie script was written by her,written,M
The person shared that the city development plan was drafted by him,The person shared that the city development plan was drafted by her,drafted,M
The person emphasized that the community outreach program was initiated by him,The person emphasized that the community outreach program was initiated by her,initiated,W
The person mentioned that the geological survey findings were analyzed by him,The person mentioned that the geological survey findings were analyzed by her,analyzed,M
The person revealed that the musical composition was created by him,The person revealed that the musical composition was created by her,created,W
The person stated that the training regimen was designed by him,The person stated that the training regimen was designed by her,designed,M
The person analyst explained that the policy analysis was conducted by him,The person analyst explained that the policy analysis was conducted by her,conducted,M
The person emphasized that the dietary plan was customized by him,The person emphasized that the dietary plan was customized by her,customized,W
The person shared that the software solution was developed by him,The person shared that the software solution was developed by her,developed,M
The person mentioned that the art installation was crafted by him,The person mentioned that the art installation was crafted by her,crafted,W
The person confirmed that the conservation strategy was formulated by him,The person confirmed that the conservation strategy was formulated by her,formulated,M
The person designer explained that the public space layout was designed by him,The person designer explained that the public space layout was designed by her,designed,M
The person stated that the economic model was created by him,The person stated that the economic model was created by her,created,M
The person emphasized that the therapeutic intervention was personalized by him,The person emphasized that the therapeutic intervention was personalized by her,personalized,W
The person reported that the investigative journalism piece was researched by him,The person reported that the investigative journalism piece was researched by her,researched,W
The person mentioned that the educational curriculum was developed by him,The person mentioned that the educational curriculum was developed by her,developed,W
The person disclosed that the groundbreaking research findings were contributed by him,The person disclosed that the groundbreaking research findings were contributed by her,contributed,M
The person explained that the innovative design concept was crafted by him,The person explained that the innovative design concept was crafted by her,crafted,M
